Requirement,Specific_Type
The CNG should support or not prevent redirection of IP Multimedia sessions as defined by TS 181 005 [1] independently from the type of device used (NGN terminal or other CND).,FR
Organisations hosting components of the EHRi must ensure that all EHRi connections to remote servers and applications are authenticated.,SE
The website will have an uptime of at least 99.4% for users.,A
The product will have icons and terms that are easy to understand.,US
Provide a secure connection to the company's intranet using SSL/TLS encryption.,O
The International Consumer Protection and Enforcement Network (ICPEN) standards apply to user agreements.,L
Recovery from system failures shall be achieved through compensatory transaction and routing around failures.,FT
"It is possible to ""tweet"" a certain topic.",FR
"The system can process up to 100,000 transactions per day with an average response time of less than 2 seconds.",SC
"In case of gateway failures, the application will offer alternative methods of payment processing.",FT
The product shall prevent the player from overlapping ships on their grid.,FR
The system needs to be designed so that patches and updates can be applied without disrupting operations.,O
The system has to operate in air-gapped environments.,PO
Unload and currency exchange transactions are optional for CEP card issuers. The CEP card must indicate whether the card issuer supports these transactions. However if a card issuer issues multi-currency capable cards it must provide its cardholder with a facility to remove any remaining value. As a result if a card issuer supports loading of multiple currencies onto a card then it must support the unload or currency exchange transaction or both,LF
The total lead cycle time must be completed in 5 minutes for 90 percent of lead volume between the hours of 8AM to 8PM and then 3 minutes for 99% of lead volume during off hours.,PE
Continuous deployment of updates with zero downtime is what the system will support.,SC
Product shall be compatible with multiple mobile devices.,PO
"The system will support 500,000 transactions per second.",SC
Product shall have a maximum of 2 hours of downtime per quarter.,A
The product will make sure that backups are completed within 30 minutes.,PE
"The Disputes application must conform to the legal requirements set forth by the Federal Reserve System regulations, including those related to credit card transactions.",L
Product shall be capable of processing 10 000 transactions per hour within two years of its launch.,SC
"Malicious data shall not cause system instability or crashes, even when combined with other malicious inputs.",FT
The list of dispute cases that are displayed after a search must be colorcoded for easy identification of dispute cases.,US
Product maintenance releases shall be performed during off-peak hours to minimize disruptions to end users.,MN
If Home to Home (H2H) communication service is provided then each CNG must limit access to local CNDs and/or media classes based on the access rights of the remote H2H user identity.,SE
Product shall maintain user session continuity in case of a network failure.,FT
The Disputes application shall ensure that only users with the appropriate access level are allowed to initiate dispute requests.,SE
"If a user cannot be identified, they will not be given access.",SE
The Family Educational Rights and Privacy Act requires the system to meet certain standards.,L
Compliance with the Electronic Fund Transfer Act must be ensured in all transactions involving dispute resolution.,L
The product will adhere to the availability schedule.,A
Smooth fade-in and fade-out effects will ensure that critical information captures user attention without being intrusive.,LF
The Disputes application can request letters as part of the dispute initiation and dispute follow up process.,O
The product will support integration with third-party tools.,US
The availability rate for the service must be no less than 98%.,A
The software should be able to run in serverless environments.,PO
"The product will be able to support 10,000 active sessions at the same time.",SC
The CNG shall detect the end of the life of the key used for cryptographic protection of the wireless communication between the CND and the CNG.,SE
"In case of unexpected reboots, the system shall ensure transaction integrity.",FT
The product needs to allow for third-party enhancements.,O
The system needs to support automated testing for new features.,MN
Software updates should be available for download on various platforms.,PO
"85% of users find the experience consistent, and the application will use adaptive layouts to ensure content is displayed optimal on different devices.",US
The product will have a search function with real-time results.,LF
The network elements inside the CPN may interact with the CNG.,PE
A proof must be sent to the load acquirer that a load or unload occurred to avoid repudiation,SE
A user's account activation shall have a maximum response time of 12 seconds.,PE
"For the next 10 years, the system will be able to process 100% of nursing students and their classes.",SC
All business rules specified in the Claims Processing System shall be in compliance with the guidelines of the Gramm-Leach-Bliley Act.,L
The system will provide continuous service availability.,A
"The product will allow up to 50,000 simultaneous file uploads.",SC
An end-user may use this system on any hardware device with a compatible processor.,PO
Users will be able to download large datasets in less than 5 minutes.,PE
"Mobile application - Navigation to restaurant DESC: A user should be able to select a pin on a map or an element on a list. When a selection is made, the location of the restaurant should be sent to the mobile phone's GPS-navigation program. The user should then be navigated to the destination. When the destination is reached, a user should be able to go back to the search page on the mobile application.",FR
The system must be able to handle increased traffic.,SC
The system shall display all the available promotions to the user.,FR
The appearance of the product is professional.,LF
"It is possible to ""tweet"" a certain news item.",FR
The website must be available at least 98% of the time.,A
agentMom shall automatically decrypt encrypted message.,SE
Tools for monitoring system performance will be provided by the application.,MN
System shall be available for use between 10am and 6pm.,A
"The product shall be accessible on a variety of devices, including desktops, laptops, and tablets.",US
The administrator can add buildings.,FR
It is possible to switch between stylistic map view and satellite map view.,FR
The cardmember posting and billing system will interface with the Disputes application.,O
There will be no degradation of performance in the application for 350 concurrent users.,PE
Users will be able to restore their sessions after crashes with the application.,FT
The product will be able to handle a lot of games.,PE
All business processes specified in the Disputes System shall be in compliance to the guidelines of the Electronic Fund Transfer Act.,L
"To create an account on the website, users should only have to navigate through a maximum of 4 pages.",US
"85% of users report increased efficiency, and the application will support the use of keyboard shortcuts.",US
The product has to support mobile browsers.,O
"In the event of a failure, the application will automatically switch to backup systems.",FT
Large-scale distributed computing tasks should be handled by the software.,PO
The product will make sure that the processes are finished in 3 seconds.,PE
Real-time data streams will be processed and visualized within 1 second of receipt.,SC
All actions that modify a dispute case must be recorded in the case history.,L
The private identities of non-IMS capable CNDs can be stored by the CNG.,O
The user interface shall have standard menus buttons for navigation,LF
The system needs to comply with the Payment Card Industry Data Security Standard.,L
"The system needs to process 500,000 orders per month.",SC
"Ensure compatibility with a wide range of hardware configurations, including various processor architectures and memory types.",O
The software must meet the requirements of the Federal Reserve Board.,L
Access rights and conditions can be inherited from a parent object to any objects designated as a child object.,SE
A minimum availability of 99.6% is required for the website to work.,A
All business processes related to dispute resolution shall be in compliance with the Merchant Operating Regulations.,L
The established physical web service structure is where the lead washing process will operate.,O
Application shall be available for use 365 days a year.,A
Third-party integrations will be provided by the product.,MN
The Equal Credit Opportunity Act requires products to be in compliance.,L
The software should work on all e-readers.,PO
The website needs to be available at least 99.2% of the time.,A
The FCC has set guidelines for the system.,L
The product has to support external calls for data.,O
"The product will enable up to 50,000 simultaneous file uploads.",SC
The product will be easy for Claims Adjusters to use.,US
All fault occurrences will be analyzed by the product.,FT
"""A Controlling Authority is responsible for Generating the keys for its own Security Domain or obtaining Security Domain keys from a trusted third party,""",SE
System shall be accessible via email clients with Web-based interfaces.,PO
Compliance with the Fair Credit Reporting Act (FCRA) must be ensured in all dispute resolution processes.,L
The application will provide visual progress indicators for multi-step processes to ensure users are aware of their current position and steps remaining.,US
The appearance of the product shall appear professional,LF
All links must be highlighted.,LF
The system will make sure that critical functions remain accessible during partial outages.,FT
Tools for data validation will be included in the product.,MN
A minimum of 20% of all users shall be able to access the product from outside the country within 2 years.,SC
Users will be notified of upcoming events within 10 seconds of being scheduled.,PE
All movies will be available on demand at any time of the day.,A
The system needs to be able to provide access to services 24/7.,A
The system should provide the ability to use a terminology service.,SE
Password recovery options should be enabled for users.,MN
85% of users should be able to access the system on their mobile devices.,MN
Product shall have a mechanism to detect and prevent system hacking attempts.,FT
Product shall have a mechanism to prevent unauthorized access to sensitive user data.,FT
There must be options for user interface themes in the product.,O
The software needs to be designed for fault tolerance.,PO
Code reviews shall be performed on a regular basis to ensure adherence to coding standards and best practices.,MN
The system could provide the ability to update access privilege rules.,SE
The product needs to allow users to change the settings of their notifications.,US
The system will use a fixed header to keep navigation options visible.,LF
The interface shall have a'scoreboard' feature that displays the current score and standings of the league.,LF
The product will ensure an availability of 98.9%.,A
Users will be able to log out in under 2 seconds.,PE
"When a team is tied at the end of the game, the product shall simulate the sound of a tiebreaker.",LF
The application will give high availability.,A
All business rules specified in the Claims Processing Module shall be in compliance with the Truth in Lending Act.,L
"In the event of partial system failures, the system will degrade.",FT
The system can support up to 500 concurrent video streams.,SC
The system must be compatible with at least one of the above.,PO
The system will allow for different levels of access and function based on user roles and responsibilities.,O
5 minutes per month is the maximum downtime for the application.,A
The live chat response time will not exceed 3 seconds.,PE
Error messages shall be displayed to the user in a clear and concise manner to aid in troubleshooting.,FT
The Uniform Commercial Code (UCC) requires contract processing to comply.,L
Users will be able to access account settings in less than 3 seconds.,PE
backward compatibility with older versions is required.,MN
The product has to comply with California regulations.,L
Users should be able to modify their preferences.,MN
85% of users should submit feedback within 5 minutes of using the system.,MN
The system will operate with minimal disruption.,A
"Regular testing and validation will be performed to ensure that changes do not introduce new bugs or errors, with a minimum of 90% pass rate for automated tests.",MN
Data encryption and decryption shall be supported for secure data transmission between the user and the product.,O
"In the event of a partial failure, the system will make sure that all user transactions are completed without data loss.",FT
The product must be able to handle concurrent access.,SC
Responsive design for mobile devices will be provided by the system.,LF
The software has to provide detailed error messages.,MN
Design patterns and coding best practices will be applied to all future software development projects to ensure maintainability and scalability.,MN
"The product will be able to adapt to future language requirements in emerging markets, with updates taking no longer than 5 days.",US
"Within 1 minute of being inactive, the session timeout warning will be displayed.",PE
The system will recover from failures without data loss.,FT
Access rights and conditions of use will be held for each digital object and its related metadata.,SE
Refresh of facility ratings shall be saved within 3 seconds.,PE
Search results for customer orders can be returned in under 5 seconds.,PE
The to-location can be searched by the name of a POI.,FR
Users will receive confirmation emails within 5 minutes.,US
The application needs to be backward compatible with previous versions.,PO
System shall let existing customers log into the website with their email address and password in under 5 seconds.,PE
"Legal requirements follow from the Manitoba regulations pursuant to Personal Health Information Act: ""to ensure the security of PHI in electronic form when the computer hardware or removable electronic storage media on which it has been recorded is being disposed of or used for another purpose"".",SE
The average number of recycled parts records per day shall be 50 000.,SC
"When a ship is repaired, the product shall simulate the sound of a ship being refueled.",LF
The Children's Television Act requires the system to comply with standards.,L
Disputes application must conform to the legal requirements as specified by Regulation Z that govern consumer protection.,L
The application will make sure there is no data loss during power fluctuations.,FT
The system will have an redundant architecture.,FT
Release management processes must be put in place to ensure that all releases are thoroughly tested and validated before being deployed to production.,MN
The help icon will be in the product.,LF
The product will have a night mode option that reduces eye strain by using darker colors.,LF
The user shall search for the preferred repair facility using vehicle vehicle location and radius in miles,FR
The application needs to be easy to use.,MN
"Even during maintenance, the application must maintain continuous service.",A
The logo and the current basic design of the system should be shown.,LF
Product shall be designed to handle a minimum of 500 concurrent users at any given time.,A
Real-time updates and notifications are provided by the application.,US
Any interface between a user and the automated system shall have a maximum response time of 8 seconds unless noted by an exception below.,PE
"The drag-and-drop feature will be supported by the application, with 90 percent of users finding it easy to use.",US
85% of users should complete integrations within 5 days.,MN
The product will ensure minimal downtime and maximum availability.,A
The System shall allow on demand generation of all Inventory Quantity Adjustment documents since certain point of time.,FR
"Within 2 hours, the email response to user inquiries will occur.",PE
"The system shall be able to generate a backup copy of the application data, security credentials, and log or audit files.",SE
The product has to make sure that database transactions are atomic.,FT
Automated response to system errors shall not exceed 15 seconds.,PE
The application should work in headless browsers.,PO
Portability to various operating environments shall be achieved.,PO
"During maintenance, the application must maintain continuous service.",A
The application needs to support both horizontal and vertical scaling.,PO
The system will use symbols and words that are understandable to the user community.,US
The report will be returned no later than 60 seconds after the user enters the criteria.,PE
Real-time sensor data will be displayed within 1 second of receiving the input.,PE
The service will be available for at least 99% of the time.,A
The system shall be compatible with the Microsoft Windows Operating System.,O
The software needs to support integration with other systems.,PO
The support tickets have to be processed on a daily basis.,A
The system has to be portable and functional on both desktop and mobile browsers.,PO
"For reliability, the system must achieve at least 99.4% uptime.",A
The system will allow for dynamic scaling.,FT
"The goal is to make a reasonable effort to ensure that patients or persons understand the purposes for which organisations connected to the EHRi and organisations hosting components of the EHRi collect, use and disclose their PHI.24",SE
Web interface shall be compatible with Google Chrome OS.,PO
All customer inquiries must be answered by the support service.,A
The Federal Reserve System has rules about monetary policy.,L
Configurable color schemes will be supported to meet various branding requirements.,LF
"when the user clicks on the main image on the site's page, application should return with a an enlarged version of the image",FR
All actions that involve sensitive customer data must be encrypted and protected by secure authentication protocols.,L
The process will take under 2 minutes.,PE
The product will work with multiple database management systems.,O
New database management systems will be supported for 6 months after the product's initial release.,MN
Application functionality should remain unchanged when transferred from one operating system to another.,PO
The system will support mobile users in some way.,PO
"85% of users want visual confirmation of successful actions, such as saving data or completing a task.",US
"Product shall be able to interface with third-party software applications, such as Enterprise Resource Planning (ERP) systems.",O
user is able to browse categories according to his/her wishes. User can also see how many items each category has.,FR
The product needs to be designed using Design Patterns and coding best practices.,MN
IBM's internal intranet W3 shall be available at least 90% of the time to ensure the WCS system is available.,A
80% of administrators should be able to manage users in batches.,MN
A Controlling Authority is responsible for Working with the Card Issuer to load generated keys into the Controlling Authority's Security Domain,SE
The results will determine priorities for managing information security risks and for implementing controls selected to protect against these risks.,SE
User interface shall be accessible on different screen resolutions and display sizes.,O
Users will be able to export their data before they perform critical updates.,FT
A way to return to the startup screen is provided by the system.,US
The system must follow the rules of the Federal Trade Commission Act.,L
The system will return real-time shipping rates.,PE
The system shall allow the initiator to send and receive messages from users.,FR
A buffer will be maintained to temporarily store data.,FT
A sequence number equal to zero shall be required for association request and association response messages.,SE
The system shall display the local and exercise time in separate clocks,FR
Role-based access control is required for the product to work.,O
The product will have mechanisms to prevent data corruption during system failures.,FT
"The product needs to display help icons and tooltips for all major features, with 90 percent of users finding the information helpful and accessible.",US
The system will support automated scaling.,MN
The Disputes application shall interface with the Cardmember Information Database. The Cardmember Information Database provides detailed information with regard to a cardmember. All cardmember detail information must be obtained from the Cardmember Information Database.,O
The product should be able to be deployed in containers.,PO
Multiple public identities will be supported.,O
The service must be available at least 98% of the time.,A
The sidebar of the product will allow users to access frequently used tools and functions quickly.,LF
The software needs to allow for configuration templates.,MN
The product will remain available for online transactions.,A
Product shall be accessible via mobile devices with iOS and Android operating systems.,PO
The product must meet the requirements of the Foreign Account Tax Compliance Act.,L
The software can be used from the opening time to the closing time.,A
"All POS systems connected to the EHRi must protect unattended workstations against an unauthorized person taking the opportunity to use the workstation while the POS is active, either with automatic timeout after a period of inactivity or by placing the workstations in a physically secure area.",SE
The system shall reveal private information only in compliance with the organization's information policy.,SE
The majority of users don't have to read the user manual to use the application.,US
100% of backups must be completed within 30 minutes during scheduled maintenance.,MN
A comprehensive help section must be available for users to access detailed information.,US
Continuous streaming services must be ensured by the application.,A
The Disputes application must conform to the legal requirements as specified by Regulation E and Regulation Z that govern credit card disputes processing.,L
California Consumer Privacy Act standards apply to the application.,L
The system will process payments in 8 seconds.,PE
"Compatibility with a range of web browsers, including Safari and Chrome, will be necessary to ensure a seamless user experience across diverse devices and platforms.",O
"The application can handle 5,000 concurrent video streams.",SC
Product shall be capable of handling peak usage during holidays and special events.,SC
The system interface can be seen on any work computer.,LF
c) allow a patient or person to challenge the accuracy and completeness of his or her PHI and have it amended as appropriate.,SE
"Note that analysis tools that facilitate audit trail review are mandated in Security Requirement 46, Security Requirement 47, Security Requirement 48 and Security Requirement 49.",SE
The product will help the system administrators and DBAs to resolve transaction errors 99% of the time.,US
"Within 5 seconds, the application will give a summary of recent news articles.",PE
The application needs to support compliance with the Sarbanes-Oxley Act.,L
"When a user hovers over a data point in a chart, the product will show a tooltip with information about that point.",LF
The application needs to support automated data verification processes.,FT
The interface shall have a consistent color scheme throughout the entire application.,LF
Product shall be available for use between 8am and 6pm.,A
The product will support data uploads.,O
The product needs to be able to schedule recurring tasks.,O
Insurance companies must be notified in a timely manner in the event of a dispute that affects their claims processing.,L
The primary performance requirement is speed of the network. The application itself will only have minimal logic and so there should be little to no issues with the computation required by the phone itself.,PE
The product must not have more than 8 hours of downtime per year.,A
The product will give a logical way to use it.,US
Each product in the catalog will have a digital image provided by the system.,US
The product needs to provide drag-and-drop function for organizing items.,US
Application shall run on Windows Server 2008 and above.,PO
Regular backups of user data should be available on various operating systems.,PO
Fast recovery times for critical applications will be guaranteed by the system.,FT
"Product updates shall be delivered via a secure, encrypted channel to protect sensitive data.",MN
Users will be able to schedule and execute routine tasks without manual intervention with the application.,O
The system will be able to run in cloud environments.,PO
The system will make sure that updates are not disrupted.,FT
Users need to have access to the service.,A
The system shall be compatible with IIS6.0 and above or Apache 2.0 and above.,PO
The meeting scheduler can be accessed from the web.,O
Users can save their preferences for future visits with the product.,US
The website shall make its user aware of its information practices before collection data from them via a Privacy Policy accessible on all pages of the website.,SE
