Requirement,Specific_Type
Productivity gains from using the product shall be consistently measured and reported.,US
The survey will be presented within 3 seconds of purchase.,PE
The interface for configuring settings must be user-friendly.,MN
The application has to comply with all the obligations outlined in the Accord.,L
Each high-definition video stream must start within 2 seconds.,PE
The search will take no longer than 15 seconds.,PE
The accuracy of the Generic Answer Population unit will be close to 70%.,PE
NPAC SMS shall provide post-collection audit analysis tools that can produce detailed reports on users relating to system intrusions.,SE
The product will be able to handle 1000 users within the next year.,SC
The product will give user insights.,O
The product shall simulate the look of ships at sea.,LF
The application needs to support compliance with the International Accounting Standards.,L
The product will be available seven days per week.,A
Product shall not be affected by a denial-of-service attack on the payment gateway.,FT
Integration with popular project management tools is supported by the product.,O
The application has to handle the efficient execution of tasks.,PE
The product must maintain a detailed audit trail of every action that a user takes on a claim case.,L
85% of viewers must understand the ongoing events from 120 feet away if the information is displayed on a 15x15 display.,US
The product will respond quickly to keep up-to-date.,PE
A clinical class shall specify the course name lecture room requirements clinical site needs lecture instructor needs and clinical lab instructor needs.,FR
98% of the users will complete their budgets within the stipulated time with the help of the system.,US
The software will meet the requirements of the USDA.,L
Backspace/reset capability is implemented for typing errors.,FR
The CNG may act as a proxy for handling messages (requests and responses) related to the remote access scenarios to and from the home.,FR
"The user shall be able to renumber the bridge key identifier and have the change made globally, This functionality shall be restricted depending on the user privilege.",SE
"The service will be accessible 24 hours a day, including weekends.",A
Users will be able to modify their profiles in less than 5 seconds.,PE
Office environments shall be the primary deployment location for the product.,O
Product shall continue to provide essential services even in the event of a network partition.,FT
The product must support multiple languages.,MN
The product will provide a real-time activity feed that updates users on recent actions and changes within the application.,LF
Load balancing will be adjusted automatically during high traffic.,FT
Action must be taken by the user to prevent the user account from being compromised.,SE
The software is expected to run on a variety of platforms.,PO
"In this case, user touches log out button, and logs out of the system. The user will not use the system until he/she logs in again.",FR
The response time of general student management tasks should take no longer than 5 seconds and the response time of schedule generation should take no longer than 30 seconds.,PE
Reports have to be easy to generate and export.,US
The response time should be fast enough to keep the game going.,PE
Once a game is initiated the product shall allow each player to position their 5 ships on their respective defensive grids.,FR
99% of the time the system will be available if the user has access to the client PC.,A
"In a high-traffic network environment, the product must function effectively.",O
Defect reports will be available to technical units on a 24x7 basis for a period of at least 6 months.,A
The system must be available 99 times for 100 user interactions.,A
The CNG shall support intra-CPN communication between IMS and non-IMS capable CNDs.,FR
All organisations hosting components of the EHRi or connecting to the EHRi must ensure that information security education and training and regular updates in organisational security policies and procedures are provided to each permanent or temporary employee or third-party contractor who is a registered user of a POS connected to the EHRi or who has access to hosted components of the EHRi.,SE
"85% of users find the customization options valuable, and the product will include a dashboard that allows users to prioritize.",US
Currently owned computer equipment will be utilized by the system.,O
Real-time monitoring will be provided to detect anomalies that may indicate a fault.,FT
"Product shall be able to process at least 500,000 transactions per month.",SC
Website shall be accessible from at least 95% of the world's countries.,A
The product will show which users are online.,LF
"Whenever the corporate network is active, the application will be operational.",A
The system shall prevent the user from changing object/project values once that project has been used in a model run.,SE
All business rules specified in the Customer Service Platform shall be in compliance with the Merchant Operating Regulations.,L
Managers and chefs don't need to read a lot of manual to use the system.,US
"The system will show users the status of their requests at all times, with visual indicators for loading processes.",US
Users should be able to access their streaming movies in under 2 clicks after logging into the website.,US
The system should perform better on both types of storage.,PO
All organisations hosting components of the EHRi must protect sites and equipment supporting the EHRi to reduce the risks from environmental threats and hazards.,SE
The application needs to be able to run on both networks.,PO
The application needs to accommodate expansion to multiple regions.,SC
The product needs to provide a visual builder.,O
"The system shall provide a fixed set of predefined, secured, administration reports to document users, user roles, application privileges, user login sessions, checked-out bridges, and other key information necessary to manage application operation.",SE
"When a referee makes a foul call, the product shall display a red flag on the screen.",LF
Emergency access to services shall be supported by the product.,A
The software should work with progressive web apps.,PO
The product shall record the transportation status of equipment reserved.,FR
"The system does not use or receive network connections and is used locally, This means that no network safety requirements exist, Overwriting an existing file on the file system has to be confirmed from the user to prevent accidental loss of data.",SE
The system will allow for dynamic scaling to accommodate different workload.,FT
Any changes to the product's configuration must be reflected in the product's version control system.,MN
Administrator PIN generation shall be saved within 10 seconds.,PE
"Database shall be available 99.5% of the time, excluding scheduled downtime.",A
The system needs to allow easy configuration of data retention policies.,MN
Product shall be capable of handling up to 500 concurrent requests. This number will increase to 1000 by Release 3.,SC
The Resource and Admission Control Subsystem (RACS) can be interacted with by the CNG to support remote real-time QoS control.,PE
"Upon detecting faults, the system will automatically start up.",FT
Before purchasing the product will give you an option to preview the content.,US
A minimum of 2 weeks' notice shall be provided to end users before any significant changes to the product's configuration are made.,MN
There will be technical support available from 8am to 10pm every day.,A
The user agreements have to comply with the UETA.,L
System shall be able to process 500 transactions per minute within two years of its launch.,SC
"After every operation, the application needs to verify data integrity.",FT
"Under standard load, the product must have a response time of 2 seconds.",O
The audit report shall include the percentage of available recycled parts used in the estimate,FR
The website will be accessed via a web browser.,O
"At any time of the day, all movies will be streamed on demand.",A
The product needs to include automated recovery.,FT
"The system will give users a summary of their recent activities, which will make it easier for 95 percent of users to track their actions.",US
The system shall allow the initiator to view the information of any meetings which they initiated.,FR
Automated backup of critical data shall occur every 4 hours.,PE
"Compliance with the Electronic Fund Transfer Act (EFTA) shall be ensured at all times, including during the processing of credit card disputes.",L
Product shall provide users with the option to restore their data from a previous backup.,FT
The application will make sure that the logs are securely stored.,MN
The product will have technical assistance.,A
The application will give an intuitive interface for configuring and managing settings.,O
The system must be able to run in a container.,PO
Support for legacy Internet browsers shall be maintained for at least two years after the product's end of life.,O
All login attempts shall be done so in a secure manner.,SE
WCS system shall have the ability to connect with other WCS databases currently not included in the system.,SC
A change management process will be implemented to ensure that all changes to the product are thoroughly tested and validated before deployment.,MN
The system needs to be easy to use in order to display all relevant data.,US
Inventory level shall be updated in real-time.,PE
"When a player's ship is repaired, the product shall simulate the sound of a ship repair crew arriving at the scene.",LF
All versions of Windows from 7 to 11 have to be fully operational.,PO
"Product updates shall be made available to all users simultaneously, with no delay in availability.",MN
Tools will be provided for tracking maintenance costs.,MN
Customer support shall be available via chat 24 hours a day 7 days a week.,A
"Access status include the following conditions: Free access, where items are freely available via internal or external delivery mechanisms to all users, Restricted access, where access requires permission or satisfaction of some criteria; authorized user access is via an internal or a secure delivery mechanism; conditions can include: User type/status (general public, NIH staff, NLM staff, administrative staff) - access dependent on who the user is in relationship to NLM and NIH, Location - access restricted to specific IP location or physical location (specific workstation), Time period - access regulated by a designated embargo, Concurrent users - access regulated by the number of concurrent users allowed to access an object at a given time.",SE
"Non-corruption of data transferred is necessary, i.e. the ability of a communication system to deliver data from its originator to its destination with an acceptable residual error rate.",SE
A consistent user experience will be ensured by the product.,US
The system needs to make it easy for users to complete all their tasks within three clicks.,US
Users should be able to access metrics within 1 minute.,MN
The product shall protect the identity of the players. The product shall provide players no access to information that might reveal the identity of another player.,PE
The system shall display the detailed information about the selected order.,FR
"-privacy, security and business continuity risks must be analysed by means of a Threat and Risk Assessment (see section 5.2) and those risks must be managed against the objectives set by the security policy;",SE
Multi- user environments are supported by the software.,PO
The website shall prevent its data from being corrupted when incorrect data is entered in.,SE
Consistency in service quality is a must for the application to accommodate expansion to multiple regions.,SC
The WCS system shall be available for use at least 95% of the time IBM's internal intranet W3 is available.,A
The UK Investigatory Powers Act must be followed by all customer data handling.,L
Product shall be able to accommodate 1000 languages to support global customers.,SC
When a game is ended the product shall allow each player to remove himself or herself from the list of players.,FR
"Data that is especially hard to extract, for whatever reason, will be manually extracted and added to the database by a developer.",FR
Only authorized personnel can access customer records in the database.,SE
User data will be retained during crashes.,FT
Automated report generation shall complete within 10 seconds.,PE
NPAC SMS shall require unique user identification codes (userids) to identify all NPAC and Service Provider personnel.,SE
The product shall comply with the laws and regulations governing data protection and privacy.,L
Statement: Authenticate EHR-S users possibly and possibly entities before allowing access to an EHR-S.,SE
NPAC SMS shall ensure that a password can not be reused by the same individual for specifiable period of time.,SE
Delete a dish Given the administrator is logged in When the administrator deletes a dish Then the deleted dish should be removed from the list of dishes,FR
"When a player's ship is upgraded, the product shall simulate the sound of a ship being modified.",LF
Product shall be able to handle up to 3000 concurrent requests within 3 years of the initial launch.,SC
The application can load user-generated content in less than 4 seconds.,PE
The product will ensure that the time to load any webpage does not exceed 3 seconds.,PE
The product can handle up to 3 million connections.,SC
The PayPal API provides all of the security checks needed to ensure that no fraudulent transactions occur.,SE
The application will make sure that all interactive elements are accessible.,LF
The product shall be intuitive and self-explanatory.,US
Vendors must take permission from the Administrator for selling their products under the site. Administrator will test product’s quality according to its market price to permit vendor for selling purpose.,FR
The software will conform to theEEOC standards.,L
The system will notify administrators of critical system events.,FT
System logs shall be transmitted to the corporate server for analysis and monitoring purposes.,O
The storage capacity must be scaled up.,SC
The product has to provide multi-factor security.,O
Users need to be able to link related data entries easily.,O
The application needs to support efficient management of concurrent user sessions.,PE
NPAC SMS shall ensure that passwords sent over public or external shared data networks are encrypted.,SE
The system will process and display real-time data within 10 seconds.,PE
The NGN network should be provided with a CND location information.,FR
b) inform complainants and inquirers of the existence of these procedures,SE
Real-time notifications will be provided by the product.,O
For any systematic (non-user initiated) action that occurs on a case such as the disputes aging process a case activity will be generated. Upon the next logon the user that initiated the dispute case must be notified that a systematic action has occurred on the dispute case.,FR
The software is required to comply with theICA for transportation regulations.,L
handicap access will be provided by the system.,US
"In an acceptable time, the product will sync contacts and appointments.",PE
The Disputes System must prevent external users from requesting original receipts. Requests for original receipts are restricted to internal users.,FR
"Security patches shall be applied to the product on a monthly basis, prior to the start of the maintenance window.",O
The application can handle up to 3000 connections per second.,SC
"Product shall be capable of processing 5000 transactions per hour within five years of its launch, with a peak demand of 10000 transactions per hour.",SC
The software needs to be compatible with legacy systems.,MN
"""A Controlling Authority is responsible for Providing load file data block signatures according to its own security policy for integrity and source authenticity.""",SE
Compliance with the Federal Information Security Management Act is supported by the system.,L
"In under 20 seconds, the application will enable bulk data exports.",PE
Users should be able to set their own data dashboards.,MN
The product needs to be flexible andScalable to grow with the business.,O
Card issuers have to inform their cardholders of the currencies they support.,L
The application will ensure that all text is legible and that it has sufficient contrast against the background.,LF
Continuous service availability for remote users is ensured by the application.,A
Product shall be able to handle up to 5000 concurrent users during peak hours.,SC
Error logs must be reviewed and analyzed daily to identify trends and areas for improvement.,MN
Product installations and upgrades will be handled by the team.,O
The application will make sure that error states are clearly indicated and that guidance is given on how to resolve issues.,LF
The EU-U.S. Privacy Shield Framework applies to cross-border data transfers.,L
80% of users should submit feedback within 2 minutes.,MN
Users of the application will be notified of system maintenance at least an hour in advance.,PE
"The product will provide GUI based Monitoring Services, System Administrators will monitor message exchanges, and internal and external support will be provided.",LF
The system will work in most browsers.,PO
The product will fail less than 5% of the time.,A
"The product can handle up to 50,000 data points per minute.",SC
"Up to 2000 simultaneous users will be supported initially, with the ability to scale to 5000 within the first year.",SC
"The application needs to support 10,000 queries.",SC
Users will be able to upload images in 10 seconds.,PE
The product will be able to handle 1000 users within a year.,SC
The system is expected to manage the nursing program curriculum and class/clinical scheduling for at least 5 years.,SC
The product will allow integration with online tools.,O
Can give feedback to the 24X7 Customer Care Service center about their impression for the site and services.,FR
The product will have integration with third-party tools.,O
Each user shall be required to log on with a unique user name and password before using the system.,SE
The system will be easy to learn for callers and supervisors.,US
Real-time data sync across devices should be supported by the application.,PO
Support shall be provided through the corporate support hotline.,O
The application needs to guarantee a 99.2% uptime throughout the year.,A
"All organisations hosting components of the EHRi must not allow equipment, data or software supporting the EHRi to be removed without authorization by the organisation's management.",SE
"3)protect the confidentiality, authenticity, availability and integrity of information;",SE
The leads washing functionality will insert all leads captured by the web service.,FR
The application needs to be up and running at 99.5%.,A
The guidelines set by the DOJ are what the system must follow.,L
The product will allow easy searching for meeting spaces.,US
On-the-go access is what the product must offer.,O
Product updates shall be delivered to customers via email notification with a clear indication of what changes have been made.,MN
The system is in line with the legal obligations outlined in the ABC.,L
"During system failures, the software will have manual override options.",FT
Product shall be able to cater to 15 simultaneous users from 9am to 5pm.,SC
Interface with a third-party inventory management system to receive and update part numbers and quantities.,O
"Risk management processes will then need to be put in place to assess, manage and mitigate risk on an ongoing basis.",SE
The system must comply with the standards of the Payment Card Industry.,L
"The system will be evoked by typing ""pine"" into a shell prompt.",O
The user should be able to personalize bookmarks to UGC.,US
1) VLER DAS stores event descriptions in an audit log for a minimum of six (6) years.,SE
For each shot the product shall notify the players whether the shot was a hit or miss.,FR
The system will give feedback to users on the success of their submission within 2 seconds.,PE
The application must not disrupt sessions.,FT
The application should function well in virtual environments.,PO
The application has to comply with the EU Regulation on passenger rights.,L
The product will have round-the-clock support.,A
Product shall be able to handle up to 2000 concurrent requests within 3 years of its launch.,SC
Software developers must be trained and certified in Design Patterns and coding best practices on a regular basis.,MN
IzognMovies will meet the licensing requirements set forth by the appropriate organizations in order to stream African movies.,L
The product can be deployed on edge computing platforms.,PO
The interface will have a responsive design that adjusts the layout and content to fit different device types.,LF
The product will enable access to any type of development environment and platform.,O
The system will make sure that all elements are in line with the guidelines of the branding and design industry.,LF
All updates must be thoroughly tested.,MN
"Within 4 seconds, the application will load the instructional videos.",PE
"The system can handle up to 1,000 simultaneous video streams.",SC
The product will meet the standards of the Payment Services Directive.,L
The CNG shall support use of one user identity on several terminals as well as to share one terminal with several identities.,FR
"Statement: Provide audit capabilities for system access and usage indicating the author, the modification (where pertinent), and the date and time at which a record was created, modified, viewed, extracted, or deleted.",SE
Server shall be able to handle 4000 concurrent users simultaneously.,SC
"The Twitter ""tweet"" interface should be according to the Twitter Guidelines.",SE
The interface should be easy to use in the interface and user survey.,LF
The changes will apply if the user clicks on the link in the email.,FR
The application needs to provide access to essential services 24/7.,A
Round-the-clock operational availability is guaranteed by the product.,A
Application shall have a maximum of 1 hour of downtime per year.,A
"Users will be able to easily switch between development, staging, and production environments with the product.",O
The implementation of specific service logics should be possible with the use of the gateways.,MN
"When a message is posted on the message board, the product shall display the sender's name and ship name.",LF
All users of the Disputes application must be informed of their rights and obligations under the Credit Card Accountability Responsibility and Disclosure (CARD) Act.,L
Quality of Service mechanisms will be supported by the CNG and the CPN.,PE
Adjusted users shall be able to quickly find information about their account status and history.,US
Product shall continue to provide services even if a dependent server is unavailable.,FT
Detailed logs for all maintenance activities will be provided by the system.,MN
The dashboard metrics will be refreshed every 15 seconds to give users the most current data.,PE
Defect tracking systems are needed to support engineers.,A
The product will allow users to modify their dashboard and settings.,US
"PDFsam does not introduce any security level, since the data it manages is not critical.",SE
The system will allow the user to scroll through the map.,US
The vendor will verify the invalid lead.,FR
"Administrative metrics - user access lists, data download estimates.",SE
Round-the-clock availability for online platforms is ensured by the product.,A
The learning curve for new users will be reduced by 70% by using a consistent and familiar design language.,US
The system will be compatible with at least one of the above.,PO
The system should be able to keep track of the incoming information.,O
All business rules specified in the Disputes System shall be in compliance with the guidelines of the Electronic Fund Transfer Act.,L
It is possible to navigate from a building on the campus to a POI on the campus.,FR
The system will make sure that updates are deployed without disrupting service.,FT
The product needs to allow for easy customization.,MN
Real-time metrics will be provided to monitor fault tolerance.,FT
"Information that the product will collect or store, which need access protections include user specified color palettes and their store of access permissions.",SE
hover effects to indicate interactive elements will be included in the interface.,LF
The Commissioner will be the only authorized user per league to adjust league settings.,SE
Real-time failure diagnostics will be included in the product.,FT
The processing time for video uploads will be no more than 30 seconds.,PE
System should be self capable with feature of Auto Suggest,FR
"It is assumed that based on jurisdictional requirements for consent that at least some POS systems connected to the EHRi may eventually have specific ""consent fields"" that will allow POS users to enter or ""check-off""how consent was obtained, withdrawn or revoked in those cases where consent was required for specific activities.",SE
All interactive elements must be clearly labeled.,LF
b) third-party facilities management for EHRi hosted components; or.,SE
The application will support hot swapping of components.,FT
"When a player is injured, the product shall display a medical alert message with the severity of the injury.",LF
