Requirement,Specific_Type
"Streaming server shall support 75 simultaneous streaming connections, with the ability to scale up to 200 connections by Release 3.",SC
The leads washing functionality will return the lead data supplied to the vendor along with the reason of rejection.,FR
"Within 6 seconds of a completed purchase, the application will generate invoices.",PE
"The system has to be able to support 300,000 users.",SC
The system shall be easy to use by callers and supervisors. Callers and supervisors must be able to accomplish any system task within 2 minutes.,US
Users must be allowed to integrate personal calendars.,O
End users will be able to easily switch between different application modes without affecting the overall performance of the product.,MN
"Users can switch between voice, touch, and traditional input methods with the system.",US
Only planned maintenance periods will allow limited downtime.,A
"General Public Access: Allows restriction to access by the general public, based on licensing terms, time period (embargo periods), location (IP range restrictions), restricted workstation access as well as other possible legal restrictions.",SE
Users must be able to restore previous versions of data.,O
The system must protect user identities from other users.,SE
"Application should be able to run on various network configurations, including Wi-Fi and Ethernet connections.",PO
"During maintenance, the application must maintain service continuity.",A
Regular code reviews will be conducted by senior developers to ensure the product's codebase remains clean and maintainable.,MN
The software was designed to run on distributed systems.,PO
The application will have background themes that reflect seasonal changes.,LF
Product shall be available for use 23 hours per day 365 days per year.,A
The product will have high availability.,A
The product must comply with the standards of the intranet page.,LF
All load transactions are on-line transactions. Authorization of funds for load transactions must require a form of cardholder verification. The load device must support on-line encrypted PIN or off-line PIN verification,SE
A Web interface should be able to handle a wide range of user interfaces and input methods.,PO
The system will make sure that user preferences are kept safe.,FT
The application needs to be able to handle multiple concurrent users.,PO
Display updates shall be refreshed every 90 seconds.,PE
The product will use a consistent color scheme.,LF
Users should be able to set up payment processing without technical assistance.,MN
The product must work with third-party tools.,MN
This prevents both malicious and false operation.,SE
Availability of the website shall be monitored by a dedicated team of IT professionals.,A
Automatic configuration of redundant settings is supported by the software.,FT
The software should allow for deployment and updating.,PO
80% of the customer base will be able to install the maintenance releases within 5 minutes.,MN
The ESIGN Act requires the system to meet certain requirements.,L
"Once the primary system is restored, automated failback will be supported by the software.",FT
All business rules specified in the Disputes System shall be in compliance with the Credit Card Accountability Responsibility and Disclosure Act.,L
The system will perform integrity checks.,FT
The product can only be accessed via secure networks.,PO
"When a ship is repaired, the product shall simulate the sound of a hammer striking an anvil.",LF
There is a link to a Facebook settings menu.,FR
"100,000 simultaneous voice calls will be handled.",SC
The system shall display all the matching products based on the search.,FR
The application should be accessible via a mobile device for on-the-go use.,PO
The Uniform Electronic Transactions Act requires user agreements to be in compliance.,L
The application will give a detailed account activity report in 10 seconds.,PE
A mechanism for repayment of funds associated with invalid transactions should be included in dispute resolution processes.,O
"A seamless user experience will be ensured by the system, which will provide a consistent look and feel across all platforms and devices.",LF
"During failures, the product will ensure that high priority services are functional.",FT
"Based on the selection the product categories will be listed: Outerwear,Soft Shell,Fleece,Knits,Wovens,Active Wear, Safety,Accessories,Team Wear, e.c.o. Collection",FR
The application must be able to process 500 concurrent data streams.,SC
The system will support active-active and active-passive setup.,FT
The application will support the roll back of failed updates.,MN
Any new features or functionality added to the product will be thoroughly tested by a minimum of 2 independent teams.,MN
"The system needs to be able to support 300,000 users.",SC
The interface will allow users to switch between languages easily.,LF
Users shall be able to easily reset system settings and preferences without requiring technical assistance,US
All actions that update a customer's order status must be recorded in the order activity log to ensure a complete audit trail and maintain accurate records.,L
The product will maintain a 99.8% uptime.,A
The product will require collaboration with a database management system (DBMS). The DBMS may be located on the same machine as the product or on a separate machine residing on the same computer network.,O
Regular updates and patches shall be performed on the product to ensure the latest security patches and features are installed.,O
Continuous availability for emergency services is ensured by the product.,A
A user shall be able to view their order history in under 1 minute.,PE
The system shall be able to display a report of needed classes for a given quarter for all cohorts of all programs for Program Administrators/Nursing Staff Members' planning purposes.,FR
The administrator will be able to de-activate a customer account in a minute.,PE
The application needs to be able to hold a database of up to 1 terabytes.,SC
The product must meet the standards of the International Federation of Accountants.,L
The product needs to provide drag-and-drop function for organizing items for most users.,US
The application will include built-in support for automated data archive and retrieval to ensure that historical data can be accessed quickly and efficiently.,O
"When a ship is launched, the product shall display a notification with a graphical representation of the ship setting sail.",LF
The system shall display the orders that are eligible to change.,FR
The product will be able to handle 1000 users in the next year.,SC
The catalog will be updated in real time.,PE
The product will handle up to 500 database operations per second.,SC
The product will allow rapid data recovery and backup processes.,SC
The system must use interchange agreement standards when exchanging information with partners.,SE
Users will be able to see their saved items in under 5 seconds.,PE
"Within 5 minutes, the system will ensure that data is synchronized with cloud storage services.",PE
The product will use symbols and words that are understandable by the community.,US
"For the next 10 years, the system will be able to process 100% of nursing students.",SC
The application has to comply with the EAR.,L
The system needs to be compatible with Kubernetes.,PO
The system will work in major browsers.,PO
An activity feed is included in the interface.,LF
The application has to be accessible to users.,A
The application should be connected to the device.,A
The interface shall display a warning message when a user attempts to access a restricted area.,LF
It must allow a user to logout.,FR
A cloud-based backup system shall be implemented to ensure data integrity and availability.,SC
Each Trusted Framework present on the card shall Ensure that incoming messages are properly routed unaltered to their intended destinations,SE
All transactions will be confirmed with the customer's web browser.,US
The Fair Trade Act protects consumers from unfair trade practices.,L
The system will have separate environments for testing and production.,FT
The system needs to provide concise error codes.,MN
toast messages will be displayed as notifications.,LF
"During business hours, the product will maintain a 99.9% uptime.",A
All employee access to sensitive data shall be restricted to authorized personnel only.,L
"An EHR-S should support Chains of Trust in respect of authentication, authorization, and privilege management, either intrinsically or by interfacing with relevant external services.",SE
"When the user receives a message, the product will show a gentle animation.",LF
instant access to historical data archives is provided by the system.,PE
NPAC SMS shall restart the login process when the threshold in R7-33.1 has been exceeded and a specified interval of time has passed.,SE
The Consumer Product Safety Act requires that the system comply with standards.,L
The product will ensure that backups are completed within 30 minutes.,PE
High contrast mode will be supported by the application.,LF
"Even in failure scenarios, the application must ensure transactional integrity.",FT
All authorized users once authenticated must be able to logon to the Disputes System,SE
The application will be available 24 hours a day.,A
Users will be able to choose from a number of data recovery methods.,FT
The system needs to ensure compliance with the Sarbanes-Oxley Act.,L
"The application maintainer should also be able to change the (lists of) information sources of the sub-applications: agenda, news, Facebook and Twitter",FR
Users will be able to remove their accounts in under 5 seconds.,PE
Application shall be able to authenticate users using at least 2 different authentication protocols.,O
Real-time updates on user activity shall be displayed within 2 seconds.,PE
Tracking project milestones and deadlines can be done with the product.,O
Product shall be able to handle up to 1000 concurrent voice calls.,SC
"When a user upgrades their account, the product shall display a confirmation screen with a success message.",LF
Incremental updates will be allowed in the application.,MN
The system will be compatible with many solutions.,PO
The software has to be compatible with legacy systems.,MN
"An end-user may use this portable application on any OS, including Linux, Windows, and macOS.",PO
A centralized notification center will make it easy for 98% of users to stay informed.,US
Internally to the CPN a CNG receiving private or other critical information (i.e. from a CND) should verify that the data was protected from unauthorised disclosure.,SE
The Digital Millennium Copyright Act requires software to comply.,L
The Issuer Security Domain shall implement one Secure Channel Protocol.,SE
The system shall link Events back to either the Sync Matrix 1.0 or the Exercise Managment Tool 1.0 applications for modifications.,FR
Design patterns and coding best practices must be used to develop and maintain all software components.,MN
"In case of server failures, the system will ensure rapid recovery and continuity.",SC
The product will be designed to respond to increased demand without requiring manual intervention.,SC
Server failure shall not occur more than once in a 30-day period.,A
NPAC SMS shall include database integrity checking utilities for the NPAC SMS database.,SE
"A user identification is a unique, auditable representation of the user's identity within the system. The NPAC SMS requires all system users, both individuals and remote machines, to be uniquely identified to support individual accountability over the NPAC Administrative and NPAC SOA Low-tech Interfaces.",SE
The DUAP Presentation Services shall require users to confirm their identity.,SE
The product will allow for long-term storage of data.,O
"Properly designed roles will ensure that users rarely, if ever, have switch roles by initiating a new session.",SE
The system needs to be able to download 1 million copies at once.,SC
Application should Build URL to each site's page,FR
Rationale: This requirement is intended to protect against a variety of denial of service attacks.,SE
The application has to support dynamic scaling.,SC
The system will run on Windows.,PO
All user data must be saved before critical operations.,FT
All user interactions with the Disputes application must be logged and stored in accordance with the Electronic Communications Privacy Act (ECPA).,L
"If a critical failure occurs, the product will give a mechanism to restore service.",FT
80% of viewers must see key Events from a distance of 60 feet if the content is to be distinguishable.,US
The system shall flag tablets that fail to send timely keep-alive messages as non-operational and disassociate the assigned waiter from the tablet.,FT
"When a shot is scored by an opponent, the product shall simulate the sound of a buzzer going off.",LF
Each POS transaction completed at the POS device is given a S5 MAC by the PSAM which is used by the merchant acquirer to validate that the transactions were made at a POS device with a valid PSAM. The batch total count and amount must be protected by the S4 MAC which must also be validated by the merchant acquirer,SE
If there is no activity for 10 minutes the user shall be logged off of the system.,SE
"Movie streaming shall be available at any time, with a maximum delay of 2 seconds.",A
The product will run on existing hardware.,O
To ensure card security and integrity the GlobalPlatform is designed to support a range of secure mechanisms for: Data integrity Resource availability Confidentiality Authentication.,SE
The interface will make it easy for users to understand their functions at a glance.,LF
Right-clicking interactive elements will display contextual menus.,LF
The product will support versioning.,O
Product shall comply with the National Institute of Standards and Technology (NIST) standards for secure data storage.,L
Monitoring of system resources is allowed by the application.,MN
Access rights and conditions of use will be machine readable and actionable.,SE
Server failure shall not cause more than 1% of the available online time.,A
The application has to render 3D graphics in under 16 milliseconds.,PE
"After every operation, the application must verify data integrity.",FT
A wide range of hardware configurations is supported by the product.,MN
The application will allow users to change the size of sections and panels.,LF
"85% of users are able to correct issues on their own, and the system must display error messages in plain language.",US
Administrator shall be able to generate a report on usage within 5 seconds.,PE
Multiple users can work on the same document at the same time with the application.,O
"Upon detecting faults, the system will automatically start to work.",FT
An activity feed will be included in the interface.,LF
The product shall have a conservative and professional appearance.,LF
The system should be able to support large user bases.,PO
"For essential operations, the application will maintain a 99.97 uptime.",A
"85% of users can resolve issues on their own, if the application ensures that all error messages are actionable.",US
System shall continue to provide essential services even if one or more dependent databases fail.,FT
Ensure seamless integration with cloud-based services to minimize downtime and maximize scalability.,O
The sound of a ship at sea will be mimicked by the product when the offensive player takes a shot.,LF
Usage of the information link DESC: The information link should be prominent and it should be evident that it is a usable link. Selecting the information link should only take one click.,FR
The application has to be able to run on both wired and wireless networks.,PO
Product shall be capable of handling peak usage during summer and winter months.,SC
The system will follow the standards set byOSHA.,L
A web-based interface should be compatible with assistive technologies such as screen readers and Braille displays.,PO
"The application will use a clean, flat design aesthetic.",LF
"Server shall be available 99.5% of the time, except during scheduled maintenance.",A
An application should be deployable on any mobile network.,PO
The media from which the product is run will affect the initial load time.,PE
Izogn Administrator needs to be able to update the category listings within 2 minutes.,PE
The product will log all failed transactions for further analysis.,FT
Product shall be able to recover from a hardware failure without significant data loss.,FT
The application has to be compatible with different storage systems.,PO
The e-commerce platform must comply with the Sarbanes-Oxley Act of 2002 regarding financial reporting and internal controls.,L
Embedded systems with limited resources should be used for the system to operate.,PO
The grids will be displayed in a circle as a view from a periscope.,LF
"Even if you're first time users, be intuitive.",LF
Users can report technical issues in under 5 seconds.,PE
The product shall interface with the corporate CRM system to retrieve customer data and update customer records.,O
Each copy of the ELSS installed must be provided with a unique (internal?) number that is automatically entered into each transmission to identify the instance of the ELSS from which the report has been transmitted.,SE
The product will provide regular performance audits.,MN
A minimalist mode will be included in the product to make it easier for focused work.,LF
Product shall not allow malicious data to propagate through the system.,FT
Fault avoidance shall be implemented based on industry standards and best practices.,FT
Refresh display after 30 minutes of inactivity.,PE
Must be able to run on a virtual machine without any performance degradation,O
Regular backups of all data must be performed on a daily basis.,MN
Regular maintenance updates must be provided by the product.,MN
Product shall interface with the existing customer relationship management (CRM) system for data synchronization.,O
The system could provide the ability to use digital signatures for attestation.,SE
Data backups can be initiated in under 15 seconds.,PE
The graphs must be clear.,US
The product shall have a feature that allows users to customize the sound effects.,LF
Product shall be able to handle a minimum of 50 000 concurrent requests within 3 years of its launch.,SC
The website shall not be offensive to religious or ethnic groups.,LF
The product will be available for 99% of the time.,A
Interface with the existing Customer Relationship Management (CRM) system to retrieve and update customer information.,O
Product shall be able to handle up to 3000 concurrent streaming connections.,SC
"80% of users report improved efficiency due to personalization, and the system will allow users to modify their interface layout.",US
Consistency of replicated data is a must for the product.,FT
"85% of users are able to fix problems on their own, and the system will ensure that error messages are displayed prominently.",US
New users will be offered training resources.,O
The new System version releases will be released at the beginning of the season.,MN
The sound of a shot hitting its target will be recreated by the product.,LF
Automatic alerts for high error rates will be enabled by the system.,FT
Continuous delivery is required to facilitate regular updates.,MN
"After a 2-day training course, 100% of the cardmember and merchant services representatives will use the Disputes application.",US
The application will provide high availability.,A
The interface will use a grid layout to organize elements.,LF
Cross-platform compatibility is essential for widespread adoption.,PO
NPAC SMS shall protect service provider data from access by unauthorized users.,SE
Users will be able to report issues within 6 seconds.,PE
"Every 20 seconds, the system will refresh the notifications.",PE
"The system needs to ensure that all interactive elements are accessible via keyboard shortcut, with 90 percent of power users reporting increased efficiency.",US
"When a player is injured, the product shall simulate the sound of a medical team responding.",LF
New data centers will be supported by the product to expand capacity and improve redundancy.,SC
"Product updates shall be delivered via a cloud-based platform, reducing the load on on-premise infrastructure.",MN
All organisations hosting components of the EHRi must control changes to information processing facilities and systems that support the EHRi by means of a formal and structured change control process to ensure the appropriate control of host applications and systems.,SE
"When a shot is missed, the product shall display a missed animation.",LF
The product shall allow a user to remove himself or herself from the list of players at any time.,FR
The system will notify affected parties when changes occur affecting clinicals including but not limited to clinical section capacity changes and clinical section cancellations.,FR
Continuous availability for critical functions is provided by the system.,A
The system will work on both Mac OS and Linux.,PO
The response should be fast enough to not interrupt the user's flow of thought.,PE
The website needs to be fully operational with MSN TV2.,O
The detail page will contain all the same features and information as the website.,FR
Processing of payment transactions shall have a maximum response time of 10 seconds.,PE
The product has to support operations in a serverless environment.,PO
"Comprehensive Privacy Impact Assessments need to address such issues as privacy risk management, record linkages, and security safeguards.",SE
Dependent databases/filesystems shall remain operational even if the product experiences a temporary failure.,FT
The application needs to be installed on both cloud and local environments.,PO
"The goal for healthcare organisations is to have PHI that is sufficiently accurate, complete and up-to-date to minimize the possibility that inappropriate PHI may be used to make a decision about a patient or person.",SE
The maximum response time for any interface between a user and the automated system is 5 seconds.,PE
Load times will be kept under 5 seconds for up to 90% of users during peak hours.,SC
The system will allow for manual intervention during complex failures.,FT
The system will allow you to return to the startup screen.,US
User session timeouts shall be reset within 1 second.,PE
Interface with external data sources shall be implemented using ODBC connections.,O
It needs to be able to change and update information on the server.,O
"85% of users find the voice interface responsive and reliable, and the application needs to support voice commands for key functions.",US
The system must not return a restricted web page to a non-authenticated user.,SE
The application must comply with the regulations.,L
Users will be able to modify their dashboardwidget.,O
"In this case, the user can approve the exchange that is offered by another user by clicking ""Approve"" button.",FR
The system must comply with the requirements for user privacy and confidentiality.,SE
The product will display each type of ship in a grid with an image of it.,LF
Automated patch management will be supported by the software.,FT
75% of users should create automated workflows within 15 minutes.,MN
Compliance with the Uniform Commercial Code must be maintained in all aspects of dispute resolution.,L
Disputes application must conform to the legal requirements set forth by the relevant state and local governments regarding consumer protection laws.,L
End-user feedback shall be collected and incorporated into software development to improve user experience and satisfaction.,MN
The product needs to be accessible 24/7.,A
The process needs to fit within the processing time conditions set by the Auto Rep Assignment process in which a lead is assigned within three minutes of the total life cycle.,PE
Enable a registered user to change his password if he forgets his password.,FR
When the student handbook-app is started the most searched items are shown on the title screen.,FR
The GUI will have a textbox that will accept inputs from a keyboard.,FR
TheEFTA requires the software to comply.,L
The system needs to be able to download 1 million copies at the same time.,SC
The product will improve task completion rates by 80%.,US
The maximum wait time for a user to navigate from one screen to another is no more than 5 seconds.,PE
Change management processes must be established to ensure that all changes are thoroughly tested and validated before being deployed to production.,MN
Users will be able to easily change their profile settings.,US
All data exchanged between the Disputes application and external systems must be securely authenticated and authorized.,L
The system must be easy to use by both managers and chefs such that they do not need to read an extensive amount of manuals.,US
All maintenance tasks need to be recorded in the software.,MN
The product will be able to send email.,O
The product shall prevent a player from viewing the offensive or defensive grids of the other player.,FR
Continuous availability for online transactions will be maintained by the product.,A
Maintenance tasks can be scheduled with the software.,MN
The product should support version control.,O
SOA to NPAC SMS interface and the NPAC SMS to Local SMS interface shall use a public key crypto system (PKCS) to provide digital signatures. Since there is no requirement for confidentiality service there is no need for any additional encryption algorithms.,SE
The product will be professional and conservative.,LF
