Requirement,Specific_Type
The system must authenticate users prior to accessing an application or data.,SE
The system must prevent access to applications or data to all non-authenticated users.,SE
The system should provide the ability to implement a Chain of Trust agreement.,SE
"The system must authenticate users using at least one of the following authentication mechanisms: username/password, digital certificate, secure token or biometrics.",SE
The system must provide the ability to create and update sets of access-control permissions granted to users.,SE
The system must record all authorization actions.,SE
The system must allow security administrators to grant authorization to users.,SE
"The system could provide the ability to authorize users based on identity, role, work assignment, present condition, location, patient consent, or patients present condition.",SE
The system must provide the ability to define system and data access rules.,SE
The system must enforce system and data access rules for all resources.,SE
"The system must monitor initial entry, modification, or data exchange, and identify the user taking the action.",SE
The system must provide additional non-repudiation functionality.,SE
"The system should prevent repudiation of data origination, receipt, or access.",SE
The system could provide the ability to obfuscate data.,SE
The system must encrypt and decrypt data that is exchanged over a non-secure link.,SE
The system must support standards-based encryption mechanisms for secure data exchange.,SE
The system must route exchanged data to authenticated sources and destinations.,SE
The system should provide audit information about additions and changes to the status of destinations and sources.,SE
The system must provide the ability to associate any attestable content with the contents author.,SE
The system must indicate the status of attestable data which has not been attested.,SE
The system must provide the ability for attestation of content by the contents author.,SE
The system could provide the ability for attestation of content by authenticated and authorized users.,SE
The system could provide the ability to use digital signatures for attestation.,SE
The system must comply with the requirements for user privacy and confidentiality.,SE
The system must provide the ability to maintain varying levels of confidentiality.,SE
The system must protect user identities from other users.,SE
The system must provide the ability to store and retrieve user record data.,SE
The system could provide the ability to identify specific data records for destruction.,SE
The system could provide the ability to destroy data records so that all traces are removed.,SE
"The system must record access and usage of systems, data, and organizational resources.",SE
The system must indicate the author of a data change.,SE
The system should indicate the viewer of data.,SE
The system could provide audit capabilities to capture system events at the hardware and software architecture level.,SE
The system must limit access to audit record information to appropriate entities.,SE
The system must provide the ability to generate an audit report to authorized users.,SE
The system should provide the ability to record system maintenance events.,SE
The system should utilize standardized time keeping.,SE
The system should provide the ability to record and report audit information using a standards-based audit record format.,SE
The system should enable the use of linked registries and directories.,SE
The system should provide the ability to link entities to external information.,SE
The system must provide the ability to extract sensitive record information only to authoried users.,SE
The system should provide secure data exchange capabilities.,SE
The system should provide the ability to identify extracted information only to authorized users.,SE
The system should enable data extraction in standard-based formats.,SE
The system should provide the ability to extract data for administrative purposes only to authorized users.,SE
The system should provide the ability to extract data for financial purposes only to authorized users.,SE
The system could provide the ability to extract data for research purposes only to authorized users.,SE
The system could provide the ability to extract data for quality analysis purposes to authenticated users only.,SE
The system should prevent the extraction of data for public health purposes by non-authenticated and non-authorized users.,SE
The system must provide the ability to update user information.,SE
The system could track user information over time.,SE
The system should provide the ability to retrieve user information discretely.,SE
The system must provide the ability to use secure registry services and directories.,SE
The system must provide secure data interchange capabilities for using registry services and directories.,SE
The system should communicate with non-local registry services through standardized secure interfaces.,SE
The system should communicate with local registry services through standardized secure interfaces.,SE
The system should provide the ability to use registries or directories to uniquely identify users.,SE
The system must provide the ability to use standard terminologies to communicate with other systems.,SE
The system should provide the ability to use a formal standard terminology model.,SE
The system should provide the ability to use hierarchical inference searches that were expressed using standard terminology models.,SE
The system should provide the ability to use a terminology service.,SE
The system must provide the ability to use different versions of terminology standards.,SE
The system must provide the ability to update terminology standards.,SE
The system should interoperate with systems that use different versions of a terminology standard.,SE
The system should provide the ability to deprecate terminologies.,SE
The system could provide the ability to deprecate individual codes within a terminology.,SE
The system must provide the ability to perform interchange operations with other systems in a secure standardized way.,SE
The system must manage structured documents.,SE
The system must be able to retrieve and display structured documents from external sources only to authorized users.,SE
The system must provide the ability to use different versions of data-interchange standards.,SE
The system must provide the ability to change the way that data is transmitted.,SE
The system should provide the ability to deprecate an interchange standard.,SE
The system should provide the ability to interoperate with other systems that use known earlier standard versions.,SE
The system must provide the ability to support standards-based application integration.,SE
The system should provide the ability to support CCOW standards for application integration.,SE
The system could provide the ability to support WfMC standards for application integration.,SE
The system could provide the ability to support SOA security standards for application integration.,SE
The system must use interchange agreement standards when exchanging information with partners.,SE
The system could provide the ability to automatically discover interchange services and capabilities.,SE
The system could provide the ability to create access privilege rules.,SE
The system could provide the ability to customize access privilege rules.,SE
"The system could provide the ability to inactivate, obsolete, or destroy access privilege rules.",SE
The system could audit all changes to access privilege rules.,SE
The system should permit local setting of application timeout.,SE
The system should log a user off a particular workstation if the user logs on to another workstation.,SE
The system must validate all user input to ensure it does not exceed the specified size.,SE
The system must determine if a user is authorized to access a restricted Web page.,SE
The system must have security mechanisms that protect against denial-of-service attacks.,SE
The system must remain resilient when facing attacks.,SE
The system must behave reliably under denial-of-service attacks.,SE
The system must ensure the integrity of a user account information.,SE
The system must not return a restricted web page to a non-authenticated user.,SE
The system must not return a restricted web page to a non-authorized user.,SE
The system must not accept overlong input data.,SE
The system must not accept invalid URLs.,SE
The system must be built following SOA web service security standards.,SE
The development processes must comply with SSE-CMM capability level 3 or above.,SE
If projected the data must be readable. On a 10x10 projection screen 90% of viewers must be able to read Event / Activity data from a viewing distance of 30,US
The product shall be available during normal business hours. As long as the user has access to the client PC the system will be available 99% of the time during the first six months of operation.,A
If projected the data must be understandable. On a 10x10 projection screen 90% of viewers must be able to determine that Events or Activities are occuring in current time from a viewing distance of 100,US
The product shall ensure that it can only be accessed by authorized users. The product will be able to distinguish between authorized and unauthorized users in all access attempts,SE
The product shall be intuitive and self-explanatory.,US
The system shall have a MDI form that allows for the viewing of the graph and the data table.,FR
The system shall display the Events in a graph by time.,FR
The Disputes application must maintain a detailed history of every action that a user takes on a dispute case. This ensures a complete audit trail if questions arise later on with regard to a particular dispute case.,L
The Disputes System must prevent users from accessing any dispute cases that do not belong to their cardholder base.,FR
The Disputes System must allow the users to select disputable transactions (based on the age of the transaction) from a user interface and initiate a dispute (ticket retrieval request or chargeback notification) on the selected transaction.,FR
The Disputes System will provide the user the ability to create or initiate a ticket retrieval request. As part of ticket retrieval creation process the system must prompt the user to enter all the required information to create the ticket retrieval request. The ticket retrieval request is a document that is sent to merchant inquiring the validity of a transaction.,FR
The Disputes System must allow the user to create three unique types of ticket retrieval requests. The three types of ticket retrieval requests are (1) Request for original receipt (2) Request for a copy of the receipt or (3) Request for a portfolio. A portfolio consists of documentation that would provide proof of a purchase such as the documentation that is received from a car rental agency that is more than a sales receipt.,FR
The Disputes System must provide a confirmation to the user upon the creation of ticket retrieval request that contains the following information; the dispute case number the type of retrieval requested (copy original or portfolio) and the date that the merchant response is due.,FR
The Disputes System shall allow the user to create or initiate a chargeback request. The system must prompt the user to enter the required information to initiate a chargeback request. The chargeback request results in a printed chargeback notification that is sent to merchant indicating that their account will be charged back if no proof is provided that the disputed transaction is valid.,FR
The Disputes System must provide a confirmation to the user upon the creation of a chargeback request. The confirmation must contain the following information; the dispute case number the type of chargeback requested (pending or immediate) and the date that the merchant response is due.,FR
The Disputes System shall prevent the creation of duplicate dispute requests 100% of the time.,FR
The Disputes System shall accurately provide a list of possible reason codes for a given transaction. The list of possible reason codes must be derived based on the type of transaction and the industry that the merchant belongs to according to the business rules defined for the Disputes System.,FR
The Disputes System must provide Search functionality. The search method must include the ability to search by (1) the dispute case number (2) the merchant account number (3) the cardmember account number and (4) the issuer number. In addition to the above criteria the search functionality must further allow the user to limit the results of the search by a date range the type of dispute (ticket retrieval request or chargeback notification) the case status (open closed or all) and the dispute reason code.,FR
A list of all disputes cases that meet the entered search criteria must be provided to the user. The list of cases must differentiate the type and/or status of the case by color -coding the line item in the list. For example all open cases will be yellow and all closed cases will be gray.,FR
The Disputes System shall provide the users the ability to view the history of all activities that have occurred on the dispute case.,FR
The Dispute System shall provide the users with the ability to follow up on a dispute case via follow-up actions. The list of available follow up actions for a given dispute case must be filtered by the status of the case and the access level of the user.,FR
The Disputes System shall record the name of the user and the date for any activity that creates or modifies the disputes case in the system. A detailed history of the actions taken on the case including the date and the user that performed the action must be maintained for auditing purposes.,FR
For any systematic (non-user initiated) action that occurs on a case such as the disputes aging process a case activity will be generated. Upon the next logon the user that initiated the dispute case must be notified that a systematic action has occurred on the dispute case.,FR
All letter requests must be formatted according to guidelines specified by the Print Letter Utility system.,FR
The product must support Internet Explorer 5.5 and above.,O
The product must support Mozilla Firefox 1.0 and above.,O
The product shall interface with the Choice Parts System. This provides the feed of recycled parts data.,O
The product shall comply with corporate User Interface Guidelines,LF
The product shall comply with corporate color scheme,LF
The software product is expected to run on Windows or Linux platforms.,PO
The product shall be easy to use by Adjusters and Collision Estimators. 95% of Adjusters and Collision Estimators shall find the product easy to use.,US
The product shall be easy to learn by Adjusters and Collision Estimators. The product shall be learned with two days onsite training,US
The user shall easily locate instructions while using the product. User help can be found within 90% of the system.,US
The search for recycled parts shall take no longer than 15 seconds. The search results shall be returned in under 15 seconds.,PE
The search for the preferred repair facility shall take no longer than 8 seconds. The preferred repair facility is returned within 8 seconds,PE
The recycled parts audit report shall be returned to the user within 10 seconds. The audit report shall be returned within 10 seconds.,PE
The product shall adhere to the corporate online availability schedule. The application is brought down only within 98% of the scheduled outages per the availability schedule.,A
The product shall be able to handle up to 1500 simultaneous users. The system shall perform with 1500 users as a time.,SC
The average number of recycled parts records per day shall be 50 000.,SC
The maintenance of the product will fall within the established corporate maintenance windows.,O
The product shall be supported using the corporate support center.,O
Only collision estimators shall search for recycled parts. Users without the collision estimator role shall not have access to the search for recycled parts.,SE
The product shall free of computer viruses.,SE
The system shall prevent malicious attacks including denial of service.,SE
The user shall search for the preferred repair facility using vehicle vehicle location and radius in miles,FR
The system shall resolve the zipcode for the street address city and state if zipcode is unknown.,FR
The system shall search for available recycled parts for the supplied vehicle parts and suppliers.,FR
The available recycled parts information and their suppliers shall be returned to the user.,FR
The estimator shall not apply recycled parts to the collision estimate if no available parts are returned.,FR
The audit report shall include the total number of recycled parts used in the estimate.,FR
The audit report shall be available to other adjusters at later points in time.,FR
The current repair facility ratings shall be displayed to the user.,FR
The user shall enter new ratings based on the audit report,FR
The product must work with most database management systems (DBMS) on the market whether the DBMS is colocated with the product on the same machine or is located on a different machine on the computer network.,O
The product will function alongside server software on any operating system where the Java runtime can be installed.,O
The product will require collaboration with a database management system (DBMS). The DBMS may be located on the same machine as the product or on a separate machine residing on the same computer network.,O
The product must make use of web/application server technology. Open source examples include Apache web server Tomcat and the JBoss application server.,O
A database management system such as Oracle DB2 MySql or HSQL will need to be integrated with the product.,O
The product shall have a conservative and professional appearance.,LF
The product shall give users feedback when necessary. 80% of the users surveyed report that the product accurately confirms their actions.,US
An employee will be able to successfully use the product within a few minutes. After informally navigating the product for less than 15 minutes users shall be able to successfully setup meetings and reserve conference rooms.,US
The product shall conform to the Americans with Disabilities Act.,US
Aside from server failure the software product shall achieve 99.99% up time.,A
The product shall be capable of handling up to 1 000 concurrent requests. This number will increase to 2 000 by Release 2. The concurrency capacity must be able to handle peak scheduling times such as early morning and late afternoon hours.,SC
The product shall be able to process 10 000 transactions per hour within two years of its launch. This number will increase to 20 000 by Release 2.,SC
The product must be able to interface with any HTML browser. The product shall transmit data between the user and the product without problems. The product shall display HTML properly in 80% of all HTML browsers tested (minimum is to test 8 browsers).,O
The product shall be available for distribution as a packaged CD.,O
The product will be available for licensing as a one-server two-five servers or five-or-more servers license.,O
A new user must be able to be added to the system within 10 minutes. 90% of new users are able to log into the system within 10 minutes.,US
The product must be designed using Design Patterns and coding best practices. 90% of maintenance software developers are able to integrate new functionality into the product with 2 working days.,MN
Maintenance releases will be offered to customers once a year. The releases shall take no longer than 5 minutes for 80% of the customer base to install.,MN
The product is expected to integrate with multiple database management systems. The product will operate with Oracle SQL Server DB2 MySQL HSQL and MS Access.,O
The product shall ensure that only company employees or external users with company-approved user IDs may have product access. 100% of all logons shall be by either company employees or external users with company-approved user IDs.,SE
Only managers are able to perform search queries for reservations by user. 100% of all search queries for reservations by user shall be from logons of only management logons.,SE
The product and/or dependent databases/filesystems shall remain operational as a result of the input of malicious data. The product and/or dependent databases/filesystems shall not crash 100% of the time that malicious data is input into the product.,FT
The product shall have the ability to receive automatic software updates as new threats emerge. 100% of customers will be able to receive automatic software updates transmitted to the installed product.,SE
The product shall have the ability to send meeting reminders to employees.,FR
The product shall store new conference rooms.,FR
The product shall update existing conference rooms.,FR
The product will be able to delete conference rooms.,FR
Each time a conference room is reserved the conference room schedule shall be updated to reflect the time and date of the reservation.,FR
The product shall send a meeting confirmation to the meeting organizer.,FR
The product shall display room equipment according to search parameters.,FR
The product shall notify building personnel of equipment transport requests.,FR
The product will allow priviledged users to view meeting schedules in multiple reporting views.,FR
The product shall be able to send meeting notifications via different kinds of end-user specified methods.,FR
The product shall have a customizable Look and Feel.,FR
The product shall have an intuitive user interface.,FR
The System shall allow for a minimum of 6 users to work at the same time.,PE
The System shall granularly control access rights to all major subsystems. It should be possible to assign access rights to all subsystems independently.,SE
The System shall meet all applicable accounting standards. The final version of the System must successfully pass independent audit performed by a certified auditor.,L
The System shall allow entering storing and modifying product formulas.,FR
Product formulas shall allow use of semi-products which have own formulas.,FR
Product formula ingredients shall allow defining substitutionary ingredients.,FR
Product formula substitutionary ingredients shall be entered automatically by the PFE subsystem.,FR
Product shall allow entering storing and modifying product menus used by POS terminals.,FR
PME Subsystem shall allow keeping submenus within menus and products within submenus in a managed and persisted order.,FR
The System shall generate Inventory Quantity Adjustment document automatically when daily Product Sales data is available.,FR
Customer shall be able to check the status of their prepaid card by entering in the PIN number in under 5 seconds.,PE
System shall let customers cancel their account process shall take no longer than 2 minutes. Database will mark the account as inactive and user will not be able to log into the website.,PE
System shall let administrator add/remove movies on the website in under 5 minutes. Entered movie information will be stored in the database and will now be available on the website.,PE
System shall let the administrator add/remove categories on the website in under 5 minutes.,PE
The website shall be attractive to all audiences. The website shall appear to be fun and the colors should be bright and vibrant.,LF
The website should have an African feel but should not alienate non-Africans. The website should use animation on pages which are describing the services to grab the users attention and encourage them to sign up.,LF
The website design should be modern clean and concise.,LF
Users should only have to navigate through a maximum of 4 pages to create an account with the website.,US
Users should be able to access their streaming movies in under 2 clicks after logging into the website.,US
The product shall be easy for customers with novice skills on the Internet to purchase and watch streaming movies. Customers should be able to purchase and watch a pre-determined movie in under 3 minutes.,US
Any interface between a user and the automated system shall have a maximum response time of 5 seconds unless noted by an exception below.,PE
"When purchasing a streaming movie or pre-paid card via credit card, the processing time should have a maximum response time of 15 seconds.",PE
All credit card information will be secured on the server and only accessible by authorized Izogn administrators. Information will be encrypted in the database.,SE
The website shall be available for use 24 hours per day 365 days per year.,A
The website shall achieve 99.5% up time.,A
All movies shall be streamed on demand at any time of the day.,A
The website shall continue to operate if the streaming server goes down.,FT
The website shall continue to operate if the payment gateway goes down.,FT
The streaming server will support 50 simultaneous streaming connections.,SC
The product shall be expected to operate within the maximum maintenance budget for a minimum of 2 years.,MN
The same hardware supporting the current website will be used to support the new system.,O
Movies shall be encoded for 56k and 256k streams.,O
The website will provide a help section with answers and solutions to common problems.,US
Only registered customers can purchase streaming movies.,SE
A customer can only stream a movie if they purchased it and are within the 2 day viewing period.,SE
