Requirement,Specific_Type
Perform the calculation required to generate a signature using the PSAM's private RSA key to allow the CEP card to validate the PSAM,SE
Be the entity that maintains control over the flow of a transaction ensuring that all security is enforced,SE
Perform the verification of signatures and certificates during a purchase and cancel last purchase transaction,SE
Ensure that CA public keys aggregation parameters blocking lists and issuer certificate revocation lists from the scheme providers are sent to the POS devices,SE
Share one or more MAC keys with connecting processors create a MAC on each transmission sent to another processor and verify the MAC on each transmission received from another processor,SE
The scheme provider must ensure that the entire process between merchants merchant acquirers card issuers and processors is auditable and reconcilable,SE
If errors in the card issuer MAC are discovered by the card issuer during its processing of the transactions a dispute mechanism established by the scheme provider may be used to have money refunded,SE
If a scheme provider establishes a central error repository all transactions for the scheme with MAC errors must be sent to that central error repository whether or not they are submitted to the dispute process,SE
A purchase transaction may be reversed prior to the removal of the CEP card from the POS device by sending a purchase reversal command to the CEP card The CEP card must authenticate the PSAM using certificates previously exchanged,SE
The amount to be reversed is the amount of the last step of the transaction. The reversal command sent to the CEP card contains a S2 MAC computed by the PSAM.,SE
The PSAM in the POS device generates a merchant acquirer S5 MAC for the transaction computes a new S4 MAC on the updated batch total count and amount and logs the transaction,SE
The CEP card authenticates the PSAM using the certificates previously received and the S2 The CEP card increments the value of the purse and logs the transaction,SE
The PSAM either retrieves or re-derives the DES session key used for the purchase transaction being cancelled. The POS device authenticates the CEP card using this key and the S1 MAC,SE
The PSAM in the POS device generates a merchant acquirer S5 MAC for the transaction and a new S4 MAC for the batch total count and amount and logs the transaction. The amount of the canceled last purchase transaction is subtracted from the header amount. The transaction is kept in a data store associated with the POS device until the merchant acquirer collects it,SE
A transaction collection process must exist. Data being transmitted from the POS devices must be transmitted in a manner that ensures integrity of the data,SE
Each POS transaction completed at the POS device is given a S5 MAC by the PSAM which is used by the merchant acquirer to validate that the transactions were made at a POS device with a valid PSAM. The batch total count and amount must be protected by the S4 MAC which must also be validated by the merchant acquirer,SE
The merchant acquirer validates the PSAM's MACs prior to accepting the POS transactions for payment. In addition selected data elements are validated to ensure correct processing by the POS device and its PSAM,SE
Each purchase transaction is signed by the CEP card with a S6 MAC which is used by the card issuer to validate that the transaction was made with a legitimate not counterfeit CEP card. The card issuer validates the CEP card's MAC,SE
Payment decisions are based on signature validations scheme provider rules and merchant and merchant acquirer agreements,SE
Pay on detail is the default payment arrangement for merchant acquirers to provide payment to their merchants. In this arrangement the merchant acquirer relies on the POS transaction S5 MAC to determine acceptance. Merchants are paid only for valid POS transactions,SE
All load transactions are on-line transactions. Authorization of funds for load transactions must require a form of cardholder verification. The load device must support on-line encrypted PIN or off-line PIN verification,SE
Off-line PIN verification must include both encrypted and unencrypted PIN,SE
The card verification method indicator (CVMI) in the CEP card must specify support of online PIN verification and at least one method of off-line PIN verification (encrypted or unencrypted),SE
Only one version of the CA public key is required in the card. This requires that the PSAMs with which the CEP card exchanges cryptograms must be capable of generating and validating cryptograms using the relevant keys from all current cards,SE
Two-way or mutual authentication where the card authenticates the terminal and the terminal authenticates the card for each transaction must be performed for off-line transactions,SE
For increased security and convenience asymmetric cryptography must be used as the authentication security for off-line transactions,SE
The card must authenticate the terminal at the point of sale ensuring that it is genuine and valid and use a two-way authentication process,SE
The terminal must authenticate the card and the transaction at the point of sale ensuring that they are genuine and valid,SE
The terminal must participate in a two-way authentication process with the card,SE
For cancel last purchase transactions the terminal must validate the card and sign the cancellation,SE
The terminal must secure transactions by retaining the card's symmetric MACing key signature as part of the transaction.,SE
The terminal must generate a symmetric MACing key signature and send it to the merchant acquirer.,SE
Incremental purchase transactions must use two-way authentication for the initial session authentication and at least one-way with the terminal authenticating the card for the remaining increments or some of the remaining increments,SE
Load and unload functions must be authenticated using end-to-end security between the card and the card issuer,SE
The issuer host must authenticate the card upon the load/unload request,SE
The card must authenticate the issuer host upon the response to the request,SE
A proof must be sent to the load acquirer that a load or unload occurred to avoid repudiation,SE
The management of keys must be accomplished in a secure certified environment,SE
There may be multiple certification authorities that manage keys for the system including the possibility of one overall highest level certification authority (perhaps on an international level) and domestic certification authorities for each country or region,SE
The system must protect the integrity of key transaction data including transaction identification currency code and amount. If tampering is suspected the system must cause the transaction to fail,SE
Funds issuers must accept funds authorization requests regardless of the load currency type as permitted,SE
Authorizations for load transactions require a form of cardholder authentication for funds requests,SE
The load device must support on-line PIN encryption or off-line PIN verification,SE
Unload transactions do not require cardholder authentication. (However an acquirer's devices may be configured such that authentication is required for access.),SE
6) The system shall provide the ability to uniquely identify a patient and tie the record to a single patient.,SE
"Statement: Capture and explicitly label patient originated data, link the data source with the data, and support provider authentication for inclusion in patient health record.",SE
The system shall securely relate medications to be administered to the unique identity of the patient (see DC.1.1.1).,SE
Appropriate time stamps for all medication related activity are generated.,SE
"Description: To reduce medication errors at the time of administration of a medication, the patient is positively identified; checks on the drug, the dose, the route and the time are facilitated.",SE
"Description: To reduce errors at the time of blood product administration, the patient is positively identified.",SE
"1) The system shall present information necessary to correctly identify the patient and accurately administer blood products including patient name, blood product number, amount, route, and time of administration.",SE
"Description: To ensure the accuracy of specimen collection, the patient and specimen are positively identified.",SE
"1) The system shall provide the ability to present information necessary to correctly identify the patient and accurately identify the specimen to be collected including, but not limited to, patient name, specimen type, specimen source, means of collection, date and time.",SE
2) The system shall apply local privacy and confidentially rules when assembling aggregate data to prevent identification of individuals by unauthorized parties.,SE
"An EHR-S must be capable of including or interfacing with standards-conformant security services to ensure that any Principal (user, organization, device , application, component, or object) accessing the system or its data is appropriately authenticated, authorized and audited in conformance with local possibly and possibly jurisdictional policies.",SE
"An EHR-S should support Chains of Trust in respect of authentication, authorization, and privilege management, either intrinsically or by interfacing with relevant external services.",SE
Statement: Authenticate EHR-S users possibly and possibly entities before allowing access to an EHR-S.,SE
Description: Both users and applications are subject to authentication.,SE
The EHR-S must provide mechanisms for users and applications to be authenticated.,SE
"Users will have to be authenticated when they attempt to use the application, the applications must authenticate themselves before accessing EHR information managed by other applications or remote EHR-S.",SE
1) The system shall authenticate principals prior to accessing an EHR-S application or EHR-S data.,SE
2) The system shall prevent access to EHR-S applications or EHR-S data to all non-authenticated principals.,SE
"4) In the absence of other appropriate authentication mechanisms, the system shall authenticate principals using at least one of the following authentication mechanisms: username or password, digital certificate, secure token or biometrics.",SE
"Enable EHR-S security administrators to grant authorizations to users, for roles, and within contexts.",SE
User based authorization refers to the permissions granted or denied based on the identity of an individual.,SE
Another user based authorization is for a tele-monitor device or robotic access to an EHR-S for prescribed directions and other input.,SE
Role based authorization refers to the responsibility or function performed in a particular operation or process.,SE
"Technical Framework for Access Control Standard as security relevant properties of the context in which an access request occurs, explicitly time, location, route of access, and quality of authentication.",SE
"In addition to the ISO standard, context authorization for an EHR-S is extended to satisfy special circumstances such as, work assignment, patient consents and authorizations, or other healthcare-related factors.",SE
2) The system shall conform to function IN.2.2 (Auditable Records) for the purpose of recording all authorization actions.,SE
"3) The system shall provide EHR-S security administrators with the ability to grant authorizations to principals according to scope of practice, organizational policy, or jurisdictional law.",SE
"4) The system shall provide EHR-S security administrators with the ability to grant authorizations for roles according to scope of practice, organizational policy, or jurisdictional law.",SE
"5) The system shall provide EHR-S security administrators with the ability to grant authorizations within contexts according to scope of practice, organizational policy, or jurisdictional law.",SE
"To ensure that access is controlled, an EHR-S must perform authentication and authorization of users or applications for any operation that requires it and enforce the system and information access rules that have been defined.",SE
"Statement: Limit an EHR-S user's ability to deny (repudiate) the origination, receipt, or authorization of a data exchange by that user.",SE
Non repudiation guarantees that the source of the data record can not later deny that it is the source; that the sender or receiver of a message cannot later deny having sent or received the message.,SE
"Non-repudiation is a way to guarantee that the source of data or record can not later deny that fact, that the sender of a message cannot later deny having sent the message, and that the recipient cannot deny having received the message.",SE
"For example, non-repudiation may be achieved through the use of a:",SE
"Digital signature, which serves as a unique identifier for an individual (much like a written signature on a paper document).",SE
Every entry in the health record must be identified with the author and should not be made or signed by someone other than the author.,SE
"Attestation functionality must meet applicable legal, regulatory and other applicable standards or requirements.",SE
1) The system shall conform to function IN.1.1 (Entity Authentication) to provide authentication capabilities.,SE
2) The system shall conform to function IN.1.2 (Entity Authorization) to provide authorization capabilities.,SE
"1) The system shall provide the ability to fully comply with the requirements for patient privacy and confidentiality in accordance with a user's scope of practice, organizational policy, or jurisdictional law.",SE
2) The system shall conform to function IN.1.1 (Entity Authentication).,SE
3) The system shall conform to function IN.1.2 (Entity Authorization).,SE
4) The system shall conform to function IN.1.3 (EntityAccess Control).,SE
5) The system should conform to function IN.1.5 (Non- Repudiation).,SE
6) The system shall conform to function IN.1.6 (Secure DataExchange).,SE
"Statement: Keep patient identities and conditions invisible to the public and other providers who do not have ""need to know"" on public tracking screens.",SE
"Statement: Provide audit capabilities for system access and usage indicating the author, the modification (where pertinent), and the date and time at which a record was created, modified, viewed, extracted, or deleted.",SE
"There is a requirement for system audit trails for the following events: Loading new versions of, or changes to, the clinical system; Loading new versions of codes and knowledge bases; Taking and restoring of backup; Changing the date and time where the clinical system allows this to be done; Archiving any data; Re-activating of an archived patient record; Entry to and exiting from the clinical system; Remote access connections including those for system support and maintenance activities;",SE
3) The system shall provide audit capabilities indicating the time stamp for an object or data creation.,SE
14) The system shall provide the ability to generate an audit report,SE
"1) The system shall provide response to information requests from providers in sub-second times so as to not impair user attention, workflow, or patient flow in the ED practice setting.",SE
The user ID and date or time stamp shall be recorded.,SE
"The system shall have the ability to provide access to standard care plan, protocol and guideline documents when requested at the time of the clinical encounter.",SE
The system shall have the ability to provide support for disclosure management in compliance with HIPAA and applicable law.,SE
The system shall provide protection to maintain the integrity of clinical data during concurrent access.,SE
"The system shall enforce the most restrictive set of rights or privileges or accesses needed by users or groups (e.g. System Administration, Clerical, Nurse, Doctor, etc.), or processes acting on behalf of users, for the performance of specified tasks.",SE
"The system must be able to associate permissions with a user using one or more of the following access controls: 1) user-based (access rights assigned to each user); 2) role-based (users are grouped and access rights assigned to these groups); or 3) context-based (role-based with additional access rights assigned or restricted based on the context of the transaction such as time-of-day, workstation-location, emergency-mode, etc.)",SE
The system shall be able to detect security-relevant events that it mediates and generate audit records for them.,SE
"The system shall record within each audit record the following information when it is available: (1) date and time of the event; (2) the component of the system (e.g. software component, hardware component) where the event occurred; (3) type of event (including: data description and patient identifier when relevant); (4) subject identity (e.g. user identity); and (5) the outcome (success or failure) of the event.",SE
The system shall provide authorized administrators with the capability to read all audit information from the audit records in one of the following two ways: 1) The system shall provide the audit records in a manner suitable for the user to interpret the information.,SE
The system shall prevent modifications to the audit records.,SE
"The system upon detection of inactivity of an interactive session shall prevent further viewing and access to the system by that session by terminating the session, or by initiating a session lock that remains in effect until the user reestablishes access using appropriate identification and authentication procedures.",SE
The system shall enforce a limit of (configurable) consecutive invalid access attempts by a user.,SE
"The system shall protect against further, possibly malicious, user authentication attempts using an appropriate mechanism (e.g. locks the account or node until released by an administrator, locks the account or node for a configurable time period, or delays the next login prompt according to a configurable delay algorithm).",SE
"When passwords are used, the system shall provide an administrative function that resets passwords.",SE
The system shall provide only limited feedback information to the user during the authentication.,SE
"When passwords are used, the system shall use either standards-based encryption, e.g., 3DES, AES, or standards-based hashing, e.g., SHA1 to store or transport passwords.",SE
"The software used to install and update the system, independent of the mode or method of conveyance, shall be certified free of malevolent software ('malware').",SE
Vendor may self-certify compliance with this standard through procedures that make use of commercial malware scanning software.,SE
"The system shall be configurable to prevent corruption or loss of data already accepted into the system in the event of a system failure (e.g. integrating with a UPS, etc.).",SE
"The system shall support protection of confidentiality of all Protected Health Information (PHI) delivered over the Internet or other known open networks via encryption using triple-DES (3DES) or the Advanced Encryption Standard (AES) and an open protocol such as TLS, SSL, IPSec, XML encryptions, or S or MIME or their successors.",SE
"The system shall support ensuring the authenticity of remote nodes (mutual node authentication) when communicating Protected Health Information (PHI) over the Internet or other known open networks using an open protocol (e.g. TLS, SSL, IPSec, XML sig, S or MIME).",SE
"The system, when storing PHI on any device intended to be portable or removable (e.g. thumb-drives, CD-ROM, PDA, Notebook), shall support use of a standards based encrypted format using triple-DES (3DES), or the Advanced Encryption Standard (AES), or their successors.",SE
"The system shall be able to generate a backup copy of the application data, security credentials, and log or audit files.",SE
The system restore functionality shall result in a fully operational and secure state.,SE
"This state shall include the restoration of the application data, security credentials, and log or audit files to their previous state.",SE
If the system claims to be available 24 by 7 then the system shall have ability to run a backup concurrently with the operation of the application.,SE
"The federal Personal Information Protection and Electronic Documents Act (PIPEDA), for example, requires all organisations to be responsible for personal information in their possession or custody, including information that has been transferred to a third party for processing.",SE
"Organisations hosting components of the EHRi, should assess, by means of a Privacy Impact Assessment, the risks to personal privacy associated with implementation of the hosted components and should implement appropriate privacy controls to mitigate identified risks.",SE
"Comprehensive Privacy Impact Assessments need to address such issues as privacy risk management, record linkages, and security safeguards.",SE
"To satisfy this legal requirement, healthcare organisations must identify the purposes for which they collect, use and disclose a patient or person's PHI.",SE
"The goal is to make a reasonable effort to ensure that patients or persons understand the purposes for which organisations connected to the EHRi and organisations hosting components of the EHRi collect, use and disclose their PHI.24",SE
"However, the novelty of the EHR and the anxiety it can arouse about the protection of privacy interests make it imperative that patients or persons be informed, in an appropriate way, of the prospective uses and disclosures of their personal information.",SE
Organisations connecting to the EHRi or organisations hosting components of the EHRi should only collect PHI necessary to fulfill the purposes that they have identified (see Privacy Requirement 5).,SE
"Rationale: The ultimate goal is to have no secret, or unspecified, collections, uses or disclosures of personal information held in an EHRi or in POS systems connected to the EHRi.",SE
"Such patients or persons have a right to know what uses and disclosures, in particular, are mandated by law, such as for mandatory reporting of infectious diseases or suspected child abuse or for law enforcement.",SE
"Laws may require express, implied or deemed consent for specific collections, uses and disclosures of PHI.",SE
"Express consent includes any action by a patient or person or their authorized representative (e.g. parent, guardian or substitute decision maker) specifically to authorize the collection, use or disclosure of personal information (e.g. a signature, a check-off box, a verbal approval).",SE
"The assumption of reasonableness usually rests on how well the patient or person was informed about the intended collection, use, or disclosure of his or her personal information.",SE
"An organisation should be able to demonstrate that it complied with applicable legislative requirements and that the patient or person had a reasonable opportunity to know that information was going to be collected and used for specific purposes and persisted with the action that resulted in the information flow.26, 27",SE
"It is assumed that based on jurisdictional requirements for consent that at least some POS systems connected to the EHRi may eventually have specific ""consent fields"" that will allow POS users to enter or ""check-off""how consent was obtained, withdrawn or revoked in those cases where consent was required for specific activities.",SE
The EHRi must reflect legal obligations in its privacy requirements in all of their relative sophistication in this novel area.,SE
"The ultimate obligation is to meet the wishes of the patient or person, in those circumstances where he or she is able to place express instructions on the allowable uses and disclosures of his or her PHI.29",SE
"In addition to meeting these legal requirements, healthcare organisations should also seek to meet high ethical and moral standards for information consent, which is vital to the protection of privacy as an aspect of human dignity and the protection of human rights.",SE
"It is important to note that a patient or person may withdraw consent at any time, subject to legal or contractual restrictions.",SE
"The POS system has to ensure that those accessing this PHI only obtain access to information that is legitimately available on the basis of consent or legal authorization to use or disclose (e.g., auditing or law enforcement).",SE
"Consequently, those organisations wishing to disclose PHI to another jurisdiction must do so in a manner that respects the legal requirements for consent in their own jurisdiction (i.e. the jurisdiction of the disclosing organisation).",SE
"As a practical matter, a healthcare organisation wishing to access PHI from another jurisdiction must do so in a manner that respects the legal requirements for consent to disclose PHI in the jurisdiction of the organisation that holds the data as well as satisfy all the legal requirements for consent to access PHI in its own jurisdiction.",SE
Information contained within a patient or person's EHR may carry with it the legal requirements for consent from multiple jurisdictions (see Privacy Requirement 12).,SE
"Furthermore, some health data protection legislation requires that health information custodians notify a patient or person if his or her information is stolen, lost, or accessed by unauthorized persons.38 The individual(s) responsible for facilitating an organisation's privacy compliance will be greatly assisted in determining when a potential ""unauthorized""access or disclosure of PHI has taken place if they are notified when an individual's consent directives are overridden.",SE
